{
  "control_id": "SOX-ITGC-AC-03",
  "control_name": "Privileged access is logged and independently reviewed",
  "framework": "SOX",
  "control_family": "ITGC-Access",
  "domain": "Privileged Access Management",
  "control_objective": "All privileged accounts on financially-significant systems are inventoried, their actions are captured in the SIEM, and each account is independently reviewed each quarter so that elevated access cannot be misused without detection.",
  "risk_addressed": "Unmonitored privileged access permits administrators to alter data, configurations, or controls outside the normal transaction path, enabling undetected fraud or error that misstates the financial statements.",
  "regulatory_mapping": {
    "framework": "SOX",
    "citation": ["SOX 404", "COSO Principle 11 (technology general controls)", "ITGC-Access-Privileged"],
    "owner_role": "IT Security Manager",
    "sdlc_gates": ["Run"],
    "applies_to_value_streams": ["Cybersecurity, Identity & Resilience", "Technology Delivery & Change"],
    "agent_skill": "sox-itgc-sdlc-compliance"
  },
  "scope": {
    "applies_to": ["Financially-significant applications"],
    "in_scope_systems": ["General Ledger", "Policy Admin", "Claims", "Billing"],
    "assessment_cycle": "Quarterly",
    "as_of_date": "2026-06-30"
  },
  "test_type": "Detective",
  "execution_mode": "AI Validate",
  "control_frequency": "Quarterly",
  "control_owner": {
    "primary_role": "IT Security Manager",
    "supporting_roles": ["Access Administrator"],
    "approval_role": "CISO"
  },
  "required_data_sources": [
    {
      "source_name": "Privileged Identity (Entra ID PIM)",
      "system_type": "IAM",
      "authoritative": true,
      "access_method": "API",
      "connector_ref": "iam.entra",
      "system_of_record": "Microsoft Entra ID Privileged Identity Management",
      "location_uri": "https://graph.microsoft.com/v1.0/roleManagement/directory/roleAssignmentScheduleInstances",
      "refresh_cadence": "Daily"
    },
    {
      "source_name": "SIEM Privileged Activity (Sentinel)",
      "system_type": "SIEM/Logging",
      "authoritative": true,
      "access_method": "API",
      "connector_ref": "siem.logging",
      "system_of_record": "Microsoft Sentinel",
      "location_uri": "https://api.loganalytics.io/v1/workspaces/<workspace-id>/query",
      "refresh_cadence": "Continuous"
    }
  ],
  "required_data_elements": [
    { "field_name": "privileged_account", "business_definition": "An account holding an elevated/administrative role on an in-scope system.", "source_name": "Privileged Identity (Entra ID PIM)", "grain": "account", "data_type": "record", "required": true },
    { "field_name": "review_decision", "business_definition": "The independent reviewer's recorded decision on each privileged account.", "source_name": "Privileged Identity (Entra ID PIM)", "grain": "account", "data_type": "record", "required": true },
    { "field_name": "privileged_action_event", "business_definition": "A logged action performed under a privileged account, captured in the SIEM.", "source_name": "SIEM Privileged Activity (Sentinel)", "grain": "event", "data_type": "record", "required": true }
  ],
  "method": {
    "summary": "Reconcile the privileged account inventory to independent review decisions and to SIEM activity logging, confirming full review coverage and full action capture.",
    "steps": [
      "Pull the inventory of privileged accounts for in-scope systems from Entra ID PIM.",
      "Pull the independent review decisions and compute the percentage of accounts reviewed.",
      "Count privileged accounts with no recorded independent review (unreviewed).",
      "Reconcile privileged accounts to the SIEM and compute the percentage of privileged actions logged.",
      "Flag any account not reviewed or any privileged action not captured in the SIEM."
    ],
    "fallback_logic": "If either source is unavailable, mark Not Run and raise a Missing Source item rather than passing."
  },
  "thresholds": {
    "materiality_basis": "Any privileged account left unreviewed, or privileged activity not logged, is a control exception.",
    "pass_tolerance": "100% reviewed, 0 unreviewed, 100% actions logged",
    "warning_threshold": "Privileged action logging below 100%",
    "escalation_threshold": "1 or more unreviewed privileged accounts"
  },
  "pass_fail_logic": {
    "pass_criteria": ["Every privileged account was independently reviewed.", "100% privileged review coverage.", "All privileged actions captured in the SIEM."],
    "fail_criteria": ["One or more privileged accounts were not reviewed.", "Privileged review coverage below 100%."],
    "exception_handling": ["Open a SOX deficiency issue.", "Complete the missing reviews and remediate logging gaps before relying on the control."]
  },
  "validation": {
    "assertion_id": "SOX-ITGC-AC-03-A",
    "automation_level": "Full",
    "check_type": "reconciliation",
    "test_script": "tests/SOX-ITGC-AC-03.test.mjs",
    "assertions": [
      { "metric": "unreviewed_privileged_accounts", "operator": "eq", "value": 0, "severity": "fail", "description": "Every privileged account was reviewed." },
      { "metric": "privileged_accounts_reviewed_pct", "operator": "gte", "value": 100, "severity": "fail", "description": "100% privileged review coverage." },
      { "metric": "privileged_actions_logged_pct", "operator": "gte", "value": 100, "severity": "warn", "description": "All privileged actions captured in the SIEM." }
    ]
  },
  "required_evidence": {
    "artifacts": ["pam_account_inventory", "privileged_activity_log", "review_signoff"],
    "evidence_repository": "sharepoint://controls/sox/itgc-access",
    "linkage_required": true,
    "retention_period": "7 years",
    "review_signoff_required": true,
    "timestamp_required": true
  },
  "downstream_linkage": {
    "required": true,
    "target_artifact_types": ["ICFR Assertion", "404 Control Matrix Row"],
    "target_systems": ["GRC"],
    "link_fields": ["control_run_id", "assessment_cycle"],
    "staleness_rule": "Must be re-evidenced each quarter before §302 certification."
  },
  "workflow": {
    "actions_on_fail": ["Open SOX deficiency issue", "Notify IT Security Manager and CISO"],
    "issue_ticket_type": "SOX Deficiency",
    "notification_roles": ["IT Security Manager", "CISO"],
    "sla_days": 30
  },
  "audit": {
    "reproducible": true,
    "version_controlled": true,
    "independent_review_required": true,
    "override_allowed": false,
    "audit_focus": ["Completeness of privileged inventory", "Independence of reviewer", "SIEM logging completeness"]
  },
  "tags": ["sox", "itgc", "access", "privileged"],
  "status": "Active",
  "version": "1.0.0"
}
